"Numer zezwolenia","Nazwa firmy","Kod pocztowy",Miejscowość,Adres,Województwo,"Data ważności"
412/22,"LONGINA  SPRYSZAK  FIRMA  HANDLOWA",23-225,Szastarka,"Polichnia Pierwsza 14","WOJ. LUBELSKIE",2024-12-19
413/22,"Kraftowe Alkohole Spółka z ograniczoną odpowiedzialnością",43-346,Bielsko-Biała,"ul. Bestwińska 143","WOJ. ŚLĄSKIE",2023-12-29
414/22,"MS4 Mateusz Snela",63-000,"Środa Wielkopolska","ul. Strzelecka 42/lok. P/02","WOJ. WIELKOPOLSKIE",2024-01-02
415/22,"NATURA SYSTEM  Grażyna i Grzegorz Maciantowicz  Spółka Jawna",41-704,"Ruda Śląska","ul. Jesionowa 22 ","WOJ. ŚLĄSKIE",2023-12-31
416/22,"Mazurska Manufaktura Spółka Akcyjna",12-100,Szczytno,"ul. Adama Mickiewicza 5","WOJ. WARMIŃSKO-MAZURSKIE",2024-01-21
417/22,"ALIANS GWÓŹDŹ   SPÓŁKA JAWNA",40-642,Katowice,"ul. Spółdzielczości 31 ","WOJ. ŚLĄSKIE",2024-01-03
418/22,"BENE   Spółka z ograniczoną odpowiedzialnością",64-010,Lubiń,"ul. A.Mickiewicza 6 ","WOJ. WIELKOPOLSKIE",2024-01-16
419/22,"RIBENA  Spółka z ograniczoną odpowiedzialnością",83-340,Sierakowice,"Wygoda Sierakowska 208","WOJ. POMORSKIE",2024-02-01
420/22,"POSEJDON - ADAMUS  Spółka z ograniczoną odpowiedzialnością",90-135,Łódź,"ul. Prezydenta Gabriela Narutowicza 40/1","WOJ. ŁÓDZKIE",2024-01-03
1/23,"Przedsiębiorstwo Produkcyjno Usługowo Handlowe  ""SIMS""  Sylwester Siatkowski",64-920,Piła,"ul. Żeromskiego 83","WOJ. WIELKOPOLSKIE",2024-01-31
1/W/23,"Przedsiębiorstwo Handlowo-Usługowe  ""MAXIM"" Mieczysław Pałysa Paweł Pałysa Spółka Jawna",08-400,Garwolin,"ul. Parysowska 2","WOJ. MAZOWIECKIE",2024-01-25
2/23,"AS-DELUXE Barbara Cygan",43-100,Tychy,"ul. Hanny i Kazimierza Wejchertów 7/lok. 83","WOJ. ŚLĄSKIE",2024-01-09
3/23,"""STABOL"" Spółka Jawna  Stoszek Stanisław - Cymor Bolesław",43-400,Cieszyn,"ul. Rudowska 33 ","WOJ. ŚLĄSKIE",2024-01-31
4/23,"Manufaktura Maurera Spółka z ograniczoną odpowiedzialnością (dawniej:P.P.H.U. Tłocznia Maurer Krzysztof Maurer)",33-390,Łącko,"Zarzecze 1B ","WOJ. MAŁOPOLSKIE",2024-02-13
5/23,"RAFAŁ DZILIŃSKI",06-400,Ciechanów,"ul. Leśna 52 ","WOJ. MAZOWIECKIE",2024-02-21
6/23,"UNIQUE SPIRITS Spółka z ograniczoną odpowiedzialnością",98-200,Sieradz,"ul. Targowa 2","WOJ. ŁÓDZKIE",2024-01-15
7/23,"Firma Handlowa ""GAJEWCZYK BIS""  Wiktor Gajewczyk",98-220,"Zduńska Wola","ul. Żytnia 14 B ","WOJ. ŁÓDZKIE",2024-02-29
8/23,"MILER SPIRITS Spółka z ograniczoną odpowiedzialnością",61-829,Poznań,"ul. Podgórna 4","WOJ. WIELKOPOLSKIE",2024-01-16
9/23,"Manufaktura Kapucynów Spółka z ograniczoną odpowiedzialnością",31-114,Kraków,"ul. Loretańska 11","WOJ. MAŁOPOLSKIE",2024-01-31
10/23,"PILOT D&S Spółka z ograniczoną odpowiedzialnością",03-310,Warszawa,"ul. Staniewicka 5","WOJ. MAZOWIECKIE",2024-01-11
11/23,"""NALEWKI STAROPOLSKIE   KAROL  MAJEWSKI  I WSPÓLNICY""  Spółka z ograniczoną odpowiedzialnością",05-092,Łomianki,"ul. Wiosenna 60 ","WOJ. MAZOWIECKIE",2024-02-07
12/23,"""WIZ""  Spółka z ograniczoną odpowiedzialnością",09-200,Sierpc,"ul. Kościuszki 8 ","WOJ. MAZOWIECKIE",2024-01-31
13/23,"WINEONLINE  Spółka z ograniczoną odpowiedzialnością",02-285,Warszawa,"ul. Szyszkowa 43 ","WOJ. MAZOWIECKIE",2024-03-31
14/23,"Firma Handlowo-Usługowa  ""GASPARO""   Marek Rams",32-340,Wolbrom,"Kąpiele Wielkie 168 a ","WOJ. MAŁOPOLSKIE",2024-01-31
15/23,"Kaprys Polski Sklep Spółka z ograniczoną odpowiedzialnością",58-200,Dzierżoniów,"Osiedle Błękitne 27","WOJ. DOLNOŚLĄSKIE",2024-01-14
16/23,"LOBO   Spółka z ograniczoną odpowiedzialnością",31-588,Kraków,"ul. Isep 9 ","WOJ. MAŁOPOLSKIE",2024-01-31
17/23,"WOLF AND OAK DISTILLERY SPÓŁKA  AKCYJNA",80-864,Gdańsk,"ul. Jana z Kolna 11","WOJ. POMORSKIE",2024-01-31
18/23,"AMKA  Spółka z ograniczoną odpowiedzialnością",02-972,Warszawa,"Aleja Rzeczypospolitej 18/83","WOJ. MAZOWIECKIE",2024-02-29
19/23,"CERVILLE INVESTMENTS  Spółka z ograniczoną odpowiedzialnością",02-705,Warszawa,"ul. Czerniowiecka 2B ","WOJ. MAZOWIECKIE",2024-02-14
20/23,"""AUCHAN POLSKA""  Spółka z ograniczoną odpowiedzialnością",05-500,Piaseczno,"ul. Puławska 46 ","WOJ. MAZOWIECKIE",2024-02-11
21/23,"HENTEX Sklep Wielobranżowy Henryk Szemet",59-400,Jawor,"ul. Królowej Marysieńki 8","WOJ. DOLNOŚLĄSKIE",2024-01-16
22/23,"Wanda Łęgosz P.H.U. RUDMAR",46-325,Rudniki,"ul. Biegańskiego 7 ","WOJ. OPOLSKIE",2024-02-16
23/23,"The Last Port Spółka z ograniczoną odpowiedzialnością Spółka komandytowa",81-350,Gdynia,"ul. Portowa 5/1","WOJ. POMORSKIE",2024-01-30
24/23,"TESSELLIS DISTILLERY Spółka z ograniczoną odpowiedzialnością",44-153,Sośnicowice,"ul. Kozielska 2","WOJ. ŚLĄSKIE",2024-02-01
25/23,"ANPAH BIS Paweł Janiak",62-800,Kalisz,"ul. Piwonicka 1 C","WOJ. WIELKOPOLSKIE",2024-02-14
26/23,"F.H.U. Jacek Chudzik",81-345,Gdynia,"al. Jana Pawła II 1","WOJ. POMORSKIE",2024-03-01
27/23,"Retail & Food Services Polska  Spółka z ograniczoną odpowiedzialnością",81-339,Gdynia,"ul. Polska 4","WOJ. POMORSKIE",2024-02-14
28/23,"""BORT-WIMAR""  Spółka Jawna",49-200,Grodków,"ul. Sienkiewicza 104","WOJ. OPOLSKIE",2024-02-19
29/23,"Syndyk Masy Upadłości Kefirek Spółka Akcyjna w Upadłości z siedzibą w Modlnicy",32-085,Modlnica,"ul. Częstochowska 48","WOJ. MAŁOPOLSKIE",2024-01-22
30/23,"""PHU WYSOKIŃSKI""  Spółka z ograniczoną odpowiedzialnością",02-972,Warszawa,"ul. Adama Branickiego 9/90","WOJ. MAZOWIECKIE",2024-02-14
31/23,"Wódki Regionalne   Spółka z ograniczoną odpowiedzialnością",43-370,Szczyrk,"ul. Myśliwska 74","WOJ. ŚLĄSKIE",2024-01-31
32/23,"""ROLMEX"" Spółka Akcyjna",02-604,Warszawa,"ul. Olkuska 7 ","WOJ. MAZOWIECKIE",2024-03-01
33/23,"MEDIPHARM INTERNATIONAL Spółka z ograniczoną odpowiedzialnością Spółka komandytowa",64-316,Kuślin,"ul. Emilii Sczanieckiej 20B","WOJ. WIELKOPOLSKIE",2024-02-06
34/23,"""Polska Dystrybucja Alkoholi""    Spółka z ograniczoną odpowiedzialnością",95-200,Pabianice,"ul. Rzgowska 276A","WOJ. ŁÓDZKIE",2024-01-31
35/23,"DRAKE Spółka z ograniczoną odpowiedzialnością",64-060,Wolkowo,"Maksymilianowo 40","WOJ. WIELKOPOLSKIE",2024-01-31
36/23,"IRJAN Spółka z ograniczoną odpowiedzialnością Spółka komandytowa",63-600,Kepno,"Mianowice 1G","WOJ. WIELKOPOLSKIE",2024-01-31
37/23,"""JAKO""   Spółka z ograniczoną odpowiedzialnością",62-817,Żelazków,"Kokanin  44 ","WOJ. WIELKOPOLSKIE",2024-02-29
38/23,"Polskie Destylarnie Spółka z ograniczoną odpowiedzialnością ",20-076,Lublin,"ul. Krakowskie Przedmieście 51/1","WOJ. LUBELSKIE",2024-01-31
39/23,"DISTRIBEV   Spółka z ograniczoną odpowiedzialnością",00-728,Warszawa,"ul. Józefa Piusa Dziekońskiego 3","WOJ. MAZOWIECKIE",2024-02-29
40/23,"ALCORA Spółka z ograniczoną odpowiedzialnością",02-237,Warszawa,"ul. Instalatorów 23","WOJ. MAZOWIECKIE",2024-03-02
41/23,"REFLEX  Spółka z ograniczoną odpowiedzialnością",43-502,Czechowice-Dziedzice,"ul. Władysława Stanisława Reymonta 18","WOJ. ŚLĄSKIE",2024-02-19
42/23,"FILABORA  FB  KOŁPA  & KOŁPA SPÓŁKA  KOMANDYTOWA",33-140,"Lisia Góra","ul. Tarnowska 7","WOJ. MAŁOPOLSKIE",2024-02-28
43/23,"Nalewki Gniewski Dwór Robert Galiński",82-500,Kwidzyn,"Gniewskie Pole 24","WOJ. POMORSKIE",2024-02-14
44/23,"PRAVDA Spółka  z ograniczoną odpowiedzialnością",43-300,"Bielsko - Biała","ul. Międzyrzecka 152 ","WOJ. ŚLĄSKIE",2024-02-29
45/23,"BALTIC SPIRITS Spółka Akcyjna",84-123,"Rekowo Górne","ul. Osiedlowa 12/1","WOJ. POMORSKIE",2024-01-31
46/23,"DRINKS  Spółka z ograniczoną odpowiedzialnością",62-200,Gniezno,"ul. Leopolda Okulickiego 21","WOJ. WIELKOPOLSKIE",2024-02-14
47/23,"FERIER Spółka z ograniczoną odpowiedzialnością",02-822,Warszawa,"ul. Poleczki 23","WOJ. MAZOWIECKIE",2024-02-14
48/23,"DOTAS Spółka z ograniczoną odpowiedzialnością",61-751,Poznań,"ul. Bóżnicza  1/14","WOJ. WIELKOPOLSKIE",2024-02-15
49/23,"HIKOEMON Spółka z ograniczoną odpowiedzialnością",00-844,Warszawa,"ul. Grzybowska 87","WOJ. MAZOWIECKIE",2024-02-06
50/23,"BARTEX  BARTOL   Spółka z ograniczoną odpowiedzialnością   Spółka Komandytowa",64-300,"Nowy  Tomyśl","Paproć  111 ","WOJ. WIELKOPOLSKIE",2024-04-01
51/23,"ORZEŁEK Spółka z ograniczoną odpowiedzialnością",35-312,Rzeszów,"ul. bp. Józefa Sebastiana Pelczara 6C/8","WOJ. PODKARPACKIE",2024-02-14
52/23,"""KAMIX""  Spółka z ograniczoną odpowiedzialnością",02-238,Warszawa,"ul. Modularna 12 lok. 400","WOJ. MAZOWIECKIE",2024-02-29
53/23,"M&P  PAVLINA  Spółka z ograniczoną odpowiedzialnością  Spółka Komandytowa",05-270,Marki,"ul. Leonida Teligi 1 A ","WOJ. MAZOWIECKIE",2024-03-31
54/23,"PPHU WIN-PIW BIS  Ireneusz Auguścik",97-570,Przedbórz,"ul. Spacerowa 2 ","WOJ. ŁÓDZKIE",2024-02-29
55/23,"Alko-Trade Krzysztof Lisiecki",77-100,Bytów,"ul. Lęborska 18","WOJ. POMORSKIE",2024-02-29
56/23,"Wojciech Herian ""Karczma Pod Wielką Solą""",32-020,Wieliczka,"ul. Grunwaldzka 46","WOJ. MAŁOPOLSKIE",2024-02-29
57/23,"Przedsiębiorstwo Handlowo-Usługowe ""TOPAZ"" Spółka z ograniczoną odpowiedzialnością (dawniej: Paczóski Zbigniew Przedsiębiorstwo Handlowo-Uslugowe ""Topaz"")",08-300,"Sokołów Podlaski","ul. Kolejowa 3 B","WOJ. MAZOWIECKIE",2024-03-16
58/23,"Manufaktura Nalewek  Spółka z ograniczoną odpowiedzialnością",38-400,Krosno,"ul. Pużaka 49 ","WOJ. PODKARPACKIE",2024-03-04
59/23,"PREMIUM CIGARS   Spółka z ograniczoną odpowiedzialnością",30-298,Kraków,"ul. Powstania Listopadowego 14","WOJ. MAŁOPOLSKIE",2024-02-26
60/23,"DMK BUDOWNICTWO K.M. POPŁAWSCY SPÓŁKA KOMANDYTOWA",18-106,"Turośń Kościelna","Markowszczyzna 80","WOJ. PODLASKIE",2024-02-12
61/23,"Winnica Libiąż Spółka z ograniczoną odpowiedzialnością",02-699,Warszawa,"ul. Kłobucka 23D/118","WOJ. MAZOWIECKIE",2024-02-09
62/23,"""BACARDI-MARTINI  POLSKA""  Spółka z ograniczoną odpowiedzialnością",02-675,Warszawa,"ul. Wołoska 22 ","WOJ. MAZOWIECKIE",2024-03-26
63/23,"MACON Spółka z ograniczoną odpowiedzialnością",81-061,Gdynia,"ul. Hutnicza 48","WOJ. POMORSKIE",2024-02-29
64/23,"""PARTNER CENTER""  Spółka z ograniczoną odpowiedzialnością",90-423,Łódź,"ul. Piotrkowska 89 ","WOJ. ŁÓDZKIE",2024-03-18
65/23,"GM KRAFT Spółka z ograniczoną odpowiedzialnością",30-519,Kraków,"ul. Jana Zamoyskiego 81","WOJ. MAŁOPOLSKIE",2024-02-23
66/23,"POLSKIE  LINIE  OCEANICZNE   Spółka Akcyjna",81-406,Gdynia,"Al. Marszałka Piłsudskiego 1","WOJ. POMORSKIE",2024-03-09
67/23,"DRAVA PETAR BURULIC",01-494,Warszawa,"ul. Widawska 5/21","WOJ. MAZOWIECKIE",2024-03-01
68/23,"""GRZEŚ"" W. SZYMCZAK  Spółka komandytowa",56-500,Syców,"ul. Kaliska 7 ","WOJ. DOLNOŚLĄSKIE",2024-04-02
69/23,"BLUMAK  Maciej Uchański",50-452,Wrocław,"ul. Komuny Paryskiej 72","WOJ. DOLNOŚLĄSKIE",2024-03-01
70/23,"POLSKI TYTOŃ  Spółka Akcyjna",26-600,Radom,"ul. Tartaczna 29 ","WOJ. MAZOWIECKIE",2024-03-20
71/23,"Hurtownia Wódki Góralskie WS & WG  Szymon Karabuła",34-500,Zakopane,"ul. Jana Kasprowicza 1","WOJ. MAŁOPOLSKIE",2024-02-29
72/23,"GURLEX  GROUP  PL   Spółka z ograniczoną odpowiedzialnością",30-444,Libertów,"ul. Bartnicka 35 ","WOJ. MAŁOPOLSKIE",2024-03-28
73/23,"Firma Galon Spółka z ograniczoną odpowiedzialnością",44-304,"Wodzisław Śląski","ul. Mszańska 4 C ","WOJ. ŚLĄSKIE",2024-03-23
74/23,"REST-D GATROX  Spółka z ograniczoną odpowiedzialnością Spółka Komandytowa",34-300,Żywiec,"ul. Stefana Batorego 16","WOJ. ŚLĄSKIE",2024-03-31
75/23,"""NEPTUN"" Ship Service LTD.   Spółka  z ograniczoną odpowiedzialnością",81-334,Gdynia,"ul. Polska  43","WOJ. POMORSKIE",2024-04-06
76/23,"Izydorczyk Michał - ""IZI""",87-700,"Aleksandrów Kujawski,  Rożno-Parcele","ul. Akacjowa 24","WOJ. KUJAWSKO-POMORSKIE",2024-03-10
77/23,"""ANPAH JANIAK""   Spółka Jawna",62-800,Kalisz,"ul. Piwonicka 1 C","WOJ. WIELKOPOLSKIE",2024-03-29
78/23,"P.H.U. LECH-POL  Spółka z ograniczoną odpowiedzialnością",62-200,Gniezno,"ul. Leopolda Okulickiego 21","WOJ. WIELKOPOLSKIE",2024-03-31
79/23,"Przedsiębiorstwo Handlowo-Usługowe   ""STANWOJ-HURT"" Spółka Jawna  Dobosz",07-104,Stoczek,"ul. Kolejowa 27 A ","WOJ. MAZOWIECKIE",2024-05-31
80/23,"Wielkopolska Manufaktura Wódek Spółka Akcyjna",62-095,"Murowana Goślina","ul. Polna 21","WOJ. WIELKOPOLSKIE",2024-03-20
81/23,"Polska Fabryka Wódek Old Distillery  Spółka z ograniczoną odpowiedzialnością",61-464,Poznań,"ul. Chmielna 8 lok. 1 ","WOJ. WIELKOPOLSKIE",2024-03-24
82/23,"Zakład Przetwórstwa Owocowo-Warzywnego  ""ORZECH""  Spółka z ograniczoną odpowiedzialnością",36-100,Kolbuszowa,"ul. Rzeszowska 7 ","WOJ. PODKARPACKIE",2024-03-31
83/23,"DOM WINA   Spółka z ograniczoną odpowiedzialnością",30-198,KRAKÓW,"ul. Balicka 255 ","WOJ. MAŁOPOLSKIE",2024-03-31
84/23,"MAROL  Spółka z ograniczoną odpowiedzialnością",61-249,Poznań,"ul. Stanisława Zwierzchowskiego 25","WOJ. WIELKOPOLSKIE",2024-04-10
85/23,"Renata Wrzesińska  MEGA-WAR",05-660,Warka,"ul. Puławska 36","WOJ. MAZOWIECKIE",2024-03-31
86/23,"Andrzej Koc Przedsiębiorstwo Usługowo-Handlowe ""KOCYK""",30-241,Kraków,"ul. Olszanicka 85","WOJ. MAŁOPOLSKIE",2024-05-28
87/23,"PGS   Spółka z ograniczoną odpowiedzialnością",01-205,Warszawa,"ul. Młynarska  7","WOJ. MAZOWIECKIE",2024-05-27
88/23,"""BEVGROUP""  Spółka z ograniczoną odpowiedzialnością",05-270,Marki,"ul. Okólna 45","WOJ. MAZOWIECKIE",2024-04-03
89/23,"PRYZMAT Walery Sulewski, Mirosław Sulewski Spółka komandytowa",22-500,Hrubieszów,"ul. Nowa 106A","WOJ. LUBELSKIE",2024-03-19
90/23,"Andrzej Marusarz Handel Obwoźny, Import Export",34-424,"Bańska Niżna","ul. Papieska 114","WOJ. MAŁOPOLSKIE",2024-03-31
91/23,"GROCHOWICA POLSKA Spółka z ograniczoną odpowiedzialnością",67-410,"Stare Strącze","Stare Strącze 43","WOJ. LUBUSKIE",2024-03-31
92/23,"""Tenczyńska Okovita"" Spółka Akcyjna",32-067,Tenczynek,"ul. Tenczyńska 59","WOJ. MAŁOPOLSKIE",2024-03-19
93/23,"GRUPA AWW Spółka z ograniczoną odpowiedzialnością",62-800,Kalisz,"Niedźwiady 45","WOJ. WIELKOPOLSKIE",2024-04-25
94/23,"Snacks and Dried Fish Spółka z ograniczoną odpowiedzialnością",30-039,Kraków,"ul. Józefitów 3/2","WOJ. MAŁOPOLSKIE",2024-03-22
95/23,"""LEVER"" Spółka Jawna  Rabiński-Drąg",23-200,Kraśnik,"ul. Narutowicza 42 ","WOJ. LUBELSKIE",2024-03-31
96/23,"VININOVA   Spółka z ograniczoną odpowiedzialnością",62-002,"Suchy Las","ul. Sprzeczna  22","WOJ. WIELKOPOLSKIE",2024-04-06
97/23,"CIELEŚNICA Spółka Akcyjna",21-504,"Rokitno, Cieleśnica","Cieleśnica-Pałac 22","WOJ. LUBELSKIE",2024-04-20
98/23,"KRAVT & CO. Spółka z ograniczoną odpowiedzialnością",02-715,Warszawa,"ul. Puławska 145","WOJ. MAZOWIECKIE",2024-03-24
99/23,"Hurtownia  ""WAKO""   Witczak  Władysław",62-731,Przykona,"Psary, ul. Sportowa   22","WOJ. WIELKOPOLSKIE",2024-04-11
100/23,"Platinum Wines Spółka z ograniczoną odpowiedzialnością",02-724,Warszawa,"ul. Wołodyjowskiego 70/1","WOJ. MAZOWIECKIE",2024-03-31
101/23,"Podkarpacka Destylarnia  Okowity  Grzegorz Pińczuk",38-530,"Zarszyn, Długie","ul. Sanocka 123","WOJ. PODKARPACKIE",2024-04-30
102/23,"Sebastian Sikorski Agencja Usługowo-Reklamowa   ""YED PRIOR""",57-500,"Bystrzyca Kłodzka","ul. Kolejowa 179","WOJ. DOLNOŚLĄSKIE",2024-04-10
103/23,"Katarzyna Turaj Przedsiębiorstwo Handlowo-Usługowe  ""KAMA""",45-340,Opole,"ul. Jakuba Kani 3 c/lok. 13","WOJ. OPOLSKIE",2024-04-15
104/23,"Czeskie Piwa Spółka z ograniczoną odpowiedzialnością Spółka komandytowa",94-039,Łódź,"ul. Walerego Wróblewskiego 128","WOJ. ŁÓDZKIE",2024-04-14
105/23,"JAKOB HABERFELD STORY Spółka z ograniczoną odpowiedzialnością",43-300,Bielsko-Biała,"ul. Michała Grażyńskiego 339","WOJ. ŚLĄSKIE",2024-03-31
106/23,"Jan Wołoch Firma Handlowo-Produkcyjna ""Wołoch-Artykuły Spożywcze""",32-200,Miechów,"ul. Krótka 5","WOJ. MAŁOPOLSKIE",2024-04-19
107/23,"MARMAX  Spółka z ograniczoną odpowiedzialnością",38-120,Czudec,"ul. Kolejowa 2A","WOJ. PODKARPACKIE",2024-04-30
108/23,"JNT GROUP  Spółka Akcyjna Spółka Komandytowa",95-082,Dobroń,"ul. Sienkiewicza  68","WOJ. ŁÓDZKIE",2024-05-11
109/23,"Regionalne Przysmaki Spółka z ograniczoną odpowiedzialnością",15-107,Białystok,"ul. Racławicka 15","WOJ. PODLASKIE",2024-04-14
110/23,"Store Trade Spółka z ograniczoną odpowiedzialnością",45-340,Opole,"ul. Jakuba Kani 3C/13","WOJ. OPOLSKIE",2024-04-26
111/23,"FRESZ   Spółka Akcyjna",10-409,Olsztyn,"ul. Lubelska 36 A ","WOJ. WARMIŃSKO-MAZURSKIE",2024-04-10
112/23,"Manufaktura Luksusu Spółka z ograniczoną odpowiedzialnością",05-200,WOŁOMIN,"ul. Waryńskiego 1","WOJ. MAZOWIECKIE",2024-05-01
113/23,"Old Polish Vodka  Spółka z ograniczoną odpowiedzialnością",17-220,Narewka,"Lewkowo Stare 19 ","WOJ. PODLASKIE",2024-05-08
114/23,"CBMAX SPIRITS  Spółka z ograniczoną odpowiedzialnością  ",84-104,"Jastrzębia Góra, Władysławowo","ul. Zygmunta III 11 ","WOJ. POMORSKIE",2024-05-18
115/23,"WIN-CIN   Spółka z ograniczoną odpowiedzialnością",10-449,Olsztyn,"ul. Piłsudskiego   64 E ","WOJ. WARMIŃSKO-MAZURSKIE",2024-05-10
116/23,"MALT INVEST  Spółka z ograniczoną odpowiedzialnością",77-310,Debrzno,"ul. Młynarska 9","WOJ. POMORSKIE",2024-04-17
117/23,"ANTRES BIS Spółka z ograniczoną odpowiedzialnością",05-077,"Wesoła, Zakręt","ul. Długa 4","WOJ. MAZOWIECKIE",2024-05-01
118/23,"Gram Sadeccy Spółka Jawna",09-402,Płock,"ul. Górna 32","WOJ. MAZOWIECKIE",2024-05-06
119/23,"Waldemar Sekuła  P.H.U. ""Sekwim Bis""",64-000,Kościan,"ul. Chłapowskiego  14 ","WOJ. WIELKOPOLSKIE",2024-05-15
120/23,"WEALTH SOLUTIONS  Spólka Akcyjna",00-032,Warszawa,"ul. Przeskok 2","WOJ. MAZOWIECKIE",2024-05-09
121/23,"""ROAN SHIP CHANDLER""   Spółka z ograniczoną odpowiedzialnością",81-061,Gdynia,"ul. Hutnicza 61","WOJ. POMORSKIE",2024-05-04
122/23,"Kompania Dystrybucyjna TEDI Spółka z ograniczoną odpowiedzialnością Spólka komandytowo-akcyjna",18-212,"Nowe Piekuty","ul. Główna 23","WOJ. PODLASKIE",2024-04-30
123/23,"Artur Grabiec Grupa Grabiec",32-660,Chełmek,"Aleja Parkowa 14","WOJ. MAŁOPOLSKIE",2024-04-20
124/23,"TRANSGOURMET POLSKA   Spółka z ograniczoną odpowiedzialnością",61-131,Poznań,"ul. Zamenhofa 133 ","WOJ. WIELKOPOLSKIE",2024-05-29
125/23,"BEVWORKS Spółka z ograniczoną odpowiedzialnością",02-757,Warszawa,"ul. Ukryty Raj 4/2","WOJ. MAZOWIECKIE",2024-04-30
126/23,"ALKOSFERA Spółka  z ograniczoną odpowiedzialnością",65-410,"Zielona Góra","ul. Fabryczna 17A/1","WOJ. LUBUSKIE",2024-05-17
127/23,"Anita Barbara Bafia  Firma Handlowo-Usługowa   ""U BAFII""",34-520,Poronin,"ul. Tatrzańska 90 ","WOJ. MAŁOPOLSKIE",2024-05-15
128/23,"Zakład Produkcji Spożywczej  Stefan Skwierawski",89-632,Brusy,"ul. Szkolna 28 ","WOJ. POMORSKIE",2024-05-14
129/23,"Global Spirits Beverages Spółka z ograniczoną odpowiedzialnością",02-972,Warszawa,"ul. Adama Branickiego 15","WOJ. MAZOWIECKIE",2024-06-30
130/23,"FOOD & WINE Spółka z ograniczoną odpowiedzialnością",32-085,Modlniczka,"ul. Komandosów 1/3","WOJ. MAŁOPOLSKIE",2024-05-10
131/23,"JMP SPIRITS Spółka z ograniczoną odpowiedzialnością",80-290,Gdańsk,"ul. Władysława Reymonta 16","WOJ. POMORSKIE",2024-05-04
132/23,"Destylarnia Sedina Spółka z ograniczoną odpowiedzialnością",72-010,Police,"ul. Tanowska 18/5A","WOJ. ZACHODNIOPOMORSKIE",2024-06-02
133/23,"JOT-Ł   Spółka z ograniczoną odpowiedzialnością",51-129,Wrocław,"ul. Żmigrodzka 249 ","WOJ. DOLNOŚLĄSKIE",2024-05-20
134/23,"Monolith Service Spółka z ograniczoną odpowiedzialnością","01-162 ",Warszawa,"ul. Św. Stanisława 1/268","WOJ. MAZOWIECKIE",2024-04-27
135/23,"BZOMEX Spółka z ograniczoną odpowiedzialnością Spółka komandytowa",32-432,PCIM,"Pcim 1","WOJ. MAŁOPOLSKIE",2024-06-14
136/23,"CRSEU Spólka z ograniczoną odpowiedzialnością",59-400,Jawor,"ul. Tadeusza Kościuszki 13D","WOJ. DOLNOŚLĄSKIE",2024-04-30
137/23,"Firma Handlowo-Usługowa   ""MIDAS""  Piotr Bobrzyk",05-300,"Mińsk Mazowiecki","ul. Franciszka Żwirki 12 A ","WOJ. MAZOWIECKIE",2024-04-30
138/23,"PR COMPANY Spółka z ograniczoną odpowiedzialnością",30-717,Kraków,"ul. Koszykarska 27B/22","WOJ. MAŁOPOLSKIE",2024-04-30
139/23,"Browary Regionalne Jakubiak Spółka z ograniczoną odpowiedzialnością",05-092,"Dziekanów Nowy","ul. Kolejowa 400","WOJ. MAZOWIECKIE",2024-05-15
140/23,"Destylernia Kamień Spółka z ograniczoną odpowiedzialnością",24-335,Łaziska,"Kamień 143","WOJ. LUBELSKIE",2024-05-31
141/23,"Wojciech Kieraś Przedsiębiorstwo Produkcyjno-Handlowo-Usługowe ""MARKUS""",98-100,Łask,"ul. Objazdowa 1B","WOJ. ŁÓDZKIE",2024-05-09
142/23,"MARANI 1915  Spółka z ograniczoną odpowiedzialnością",02-796,Warszawa,"ul. Wąwozowa nr 23, lok. U1 ","WOJ. MAZOWIECKIE",2024-05-14
143/23,"""Tenczynek Dystrybucja"" Spółka Akcyjna",20-113,Lublin,"ul. Archidiakońska 9","WOJ. LUBELSKIE",2024-05-09
144/23,"Mazurskie Miody  Bogdan Piasecki",11-034,Tomaszkowo,"ul. Pszczela 10","WOJ. WARMIŃSKO-MAZURSKIE",2024-06-02
145/23,"""BIG"" Spółka z ograniczoną odpowiedzialnością",82-300,Elbląg,"ul. Żuławska 15/C","WOJ. WARMIŃSKO-MAZURSKIE",2024-05-31
146/23,"BJC DISTRIBUTION  Spółka z ograniczoną odpowiedzialnością",02-869,Warszawa,"ul. Buszycka 5 ","WOJ. MAZOWIECKIE",2024-05-28
147/23,"Firma Handlowo-Usługowa   ""PATRO-MAG""   Spółka Cywilna  Aneta Racka-Dasiewicz, Arkadiusz Dasiewicz",09-460,"Mała Wieś","ul. Płońska 9F","WOJ. MAZOWIECKIE",2024-06-30
148/23,"Andrzej Kostyk  Przedsiębiorstwo Przemysłu Spirytusowego  ""Wódki Raciborskie""",47-400,Racibórz,"ul. Opawska 8 lok. 1 ","WOJ. ŚLĄSKIE",2024-05-31
149/23,"Black Watch Spirits Polska Społka z ograniczoną odpowiedzialnością",01-066,Warszawa,"ul. Klopot 4/58","WOJ. MAZOWIECKIE",2024-05-21
150/23,"""CARREFOUR POLSKA""  Spółka z ograniczoną odpowiedzialnością",03-734,Warszawa,"ul. Targowa 72 ","WOJ. MAZOWIECKIE",2024-07-09
151/23,"Przedsiębiorstwo Produkcyjno Handlowo Usługowe   ""SPECJAŁ""   Spółka z ograniczoną odpowiedzialnością",00-175,Warszawa,"Aleja Jana Pawła II 80 lok. 5 ","WOJ. MAZOWIECKIE",2024-06-23
152/23,"NO.1 BEVERAGES POLAND  Spółka z ograniczoną odpowiedzialnością",80-299,Gdańsk,"ul. Astronomów 14 ","WOJ. POMORSKIE",2024-06-27
153/23,"Przedsiębiorstwo Voyal Wojciechowski Jacek",58-508,Siedlęcin,"ul. Ogrodowa 27B","WOJ. DOLNOŚLĄSKIE",2024-05-31
154/23,"Hurtownia Owoców i Warzyw ""KOKOS""  Wiesław Razuwajew",06-100,Pułtusk,"ul. Mickiewicza  41/43 ","WOJ. MAZOWIECKIE",2024-06-10
155/23,"VAN PUR Spółka Akcyjna",37-111,Rakszawa,"Rakszawa 334","WOJ. PODKARPACKIE",2024-07-16
156/23,"""POLTREP""  Spółka Cywilna  Andrzej Wadowski, Barbara Wadowska, Mieczysław Wadowski",30-698,Kraków,"ul. Syreńskiego 19 A ","WOJ. MAŁOPOLSKIE",2024-06-30
157/23,"In-Out Bartłomiej Szajer",32-086,Węgrzce,"ul. Forteczna 1 A/109","WOJ. MAŁOPOLSKIE",2024-05-31
158/23,"Włodek Dawid - ""PH Włodek""",58-211,Uciechów,"ul. Piastowska 29","WOJ. DOLNOŚLĄSKIE",2024-05-20
159/23,"Eurofoods Gastro Spółka z ograniczoną odpowiedzialnością",05-850,"Ożarów Mazowiecki, Konotopa","ul. Rajdowa 11","WOJ. MAZOWIECKIE",2024-06-07
160/23,"WESTTRADE ALKOHOLE Spółka z ograniczoną odpowiedzialnością",83-207,Kokoszkowy,"ul. Lipowa 14","WOJ. POMORSKIE",2024-05-31
161/23,"HAVI LOGISTICS   Spółka z ograniczoną odpowiedzialnością",03-230,Warszawa,"ul. Daniszewska 25 ","WOJ. MAZOWIECKIE",2024-07-13
162/23,"BBSPIRITS Spółka z ograniczoną odpowiedzialnością",64-920,Piła,"ul. Krzywa 35","WOJ. WIELKOPOLSKIE",2024-06-20
163/23,"SPS HANDEL Spółka z ograniczoną odpowiedzialnością",02-390,Warszawa,"ul. Grójecka 194  lok. 91 ","WOJ. MAZOWIECKIE",2024-08-31
164/23,"VDV Spółka z ograniczoną odpowiedzialnością",04-853,Warszawa,"ul. Zagajnikowa 10","WOJ. MAZOWIECKIE",2024-06-14
165/23,"EUROSTOCK Spółka z  ograniczoną odpowiedzialnością",15-102,Białystok,"ul. Bitwy Białostockiej 5","WOJ. PODLASKIE",2024-06-19
166/23,"MORDO CORP Spółka z ograniczoną odpowiedzialnością",32-070,Czernichów,"ul. Wiślana 23","WOJ. MAŁOPOLSKIE",2024-06-19
167/23,"""ALEMBIK POLSKA""  Spółka Akcyjna",20-113,Lublin,"ul. Archidiakońska 9","WOJ. LUBELSKIE",2024-05-31
168/23,"BUH DISTILLERY  Spółka z ograniczoną odpowiedzialnością",20-113,Lublin,"ul. Archidiakońska 9","WOJ. LUBELSKIE",2024-05-31
169/23,"VIP  INVESTMENTS Spółka z ograniczoną odpowiedzialnością",80-299,Gdańsk,"ul. Koziorożca 33/6","WOJ. POMORSKIE",2024-06-12
170/23,"""EUROCASH"" SPÓŁKA  AKCYJNA",62-052,Komorniki,"ul. Wiśniowa 11 ","WOJ. WIELKOPOLSKIE",2024-06-14
171/23,"MS Krzysztof Miszczak Beata Miszczak Piotr Skotnicki Spółka Cywilna",55-200,Oława,"ul. Opolska 7","WOJ. DOLNOŚLĄSKIE",2024-06-11
172/23,"Oktan Energy - Wina  Spółka z ograniczoną odpowiedzialnością",70-606,Szczecin,"ul. Hryniewieckiego 1","WOJ. ZACHODNIOPOMORSKIE",2024-06-04
173/23,"Piotr Piskorski  Przedsiębiorstwo Produkcyjno-Usługowo-Handlowe",21-200,Parczew,"ul. Kolejowa 207 ","WOJ. LUBELSKIE",2024-06-30
174/23,"GRUPA  RADLER  Spółka z ograniczoną odpowiedzialnością",34-300,Żywiec,"ul. Jodłowa 73 ","WOJ. ŚLĄSKIE",2024-06-06
175/23,"AMBRA BRANDS Spólka z ograniczoną odpowiedzialnością",02-819,Warszawa,"ul. Puławska 336","WOJ. MAZOWIECKIE",2024-06-30
176/23,"UDH - UNITED DISTRIBUTION HOLDING  Spółłka z ograniczoną odpowiedzialnością Spółka komandytowo-akcyjna",60-267,Poznań,"ul. Józefa Rogalińskiego 13","WOJ. WIELKOPOLSKIE",2024-06-30
177/23,"Florencja Dystrybucja Spółka z ograniczoną odpowiedzialnoscią",20-306,Lublin,"ul. Firlejowska 2/1","WOJ. LUBELSKIE",2024-06-07
178/23,"CRIMSTON Spółka z ograniczoną odpowiedzialnością",02-017,Warszawa,"Aleje Jerozolimskie 123A","WOJ. MAZOWIECKIE",2024-07-20
179/23,"F.H. ""FUERTE"" Ewa Żak",32-700,Proszówki,"Proszówki 36","WOJ. MAŁOPOLSKIE",2024-06-13
180/23,"ALKOHOLE ŚWIATA  Spółka z ograniczoną odpowiedzialnością",11-600,Węgorzewo,"ul. Przemysłowa 7 a ","WOJ. WARMIŃSKO-MAZURSKIE",2024-06-17
