"Numer zezwolenia","Nazwa firmy","Kod pocztowy",Miejscowość,Adres,Województwo,"Data ważności"
181/23,"SCM   Spółka z ograniczoną odpowiedzialnością",00-828,Warszawa,"Al.  Jana Pawła II nr 11 ","WOJ. MAZOWIECKIE",2024-06-28
182/23,"""FOCZKA"" Tomasz Gąsiorek",32-020,Bodzanów,"Bodzanów 501","WOJ. MAŁOPOLSKIE",2024-06-30
183/23,"SPAR Spółka z ograniczoną odpowiedzialnością",60-476,Poznań,"ul. Druskienicka 12","WOJ. WIELKOPOLSKIE",2024-07-14
184/23,"""RADEX""  Spółka z ograniczoną odpowiedzialnością",42-133,"Węglowice, Puszczew","Puszczew 75","WOJ. ŚLĄSKIE",2024-06-30
185/23,"Sławomir Załęski Sklep Spożywczo-Przemysłowy-Delikatesy ""DELICJA""",07-410,Ostrołęka,"ul. Henryka Sienkiewicza 5","WOJ. MAZOWIECKIE",2024-07-24
186/23,"""MIREX"" Spółka z ograniczoną odpowiedzialnością",43-300,Bielsko-Biała,"ul. Witosa 10","WOJ. ŚLĄSKIE",2024-07-31
187/23,"Browar Toruński Toruń Spółka z ograniczoną odpowiedzialnością",87-100,Toruń,"ul. Kociewska 22","WOJ. KUJAWSKO-POMORSKIE",2024-07-02
188/23,"NETTO Spółka z ograniczoną odpowiedzialnością",73-108,Kobylanka,"Motaniec 30","WOJ. ZACHODNIOPOMORSKIE",2024-07-18
189/23,"B&W Premium Spirits Spółka z ograniczoną odpowiedzialnością",05-825,"Grodzisk Mazowiecki","ul. Graniczna 30","WOJ. MAZOWIECKIE",2024-07-29
190/23,"""ART-MAR""   A.Gozdowski M.Gozdowski K.Gozdowski  Spółka Jawna",09-500,Gostynin,"ul. Płocka 25 ","WOJ. MAZOWIECKIE",2024-07-22
191/23,"YOURA SPIRITS Spółka z ograniczoną odpowiedzialnością",30-714,Kraków,"ul. Gromadzka 24C","WOJ. MAŁOPOLSKIE",2024-06-30
192/23,"ARENA 2000 Spółka z ograniczoną odpowiedzialnością",87-300,Brodnica,"ul. Nad Drwęcą 15","WOJ. KUJAWSKO-POMORSKIE",2024-07-12
193/23,"""DICTADOR EUROPE"" Spółka z ograniczoną odpowiedzialnością",40-611,Katowice,"ul. Fabryczna 15","WOJ. ŚLĄSKIE",2024-07-11
194/23,"BJANEX  Spółka z ograniczoną odpowiedzialnością",16-400,Suwałki,"ul. Leśna 68","WOJ. PODLASKIE",2024-08-31
195/23,"GS TRZEBIATÓW Spółka z ograniczoną odpowiedzialnością",72-320,Trzebiatów,"ul. Rynek 2 ","WOJ. ZACHODNIOPOMORSKIE",2024-08-14
196/23,"MARCIN MŁODOŻENIEC",40-115,Katowice,"ul. Johna Baildona 20D/15","WOJ. ŚLĄSKIE",2024-07-31
197/23,"FARUTEX Spółka z ograniczoną odpowiedzialnością",70-807,Szczecin,"ul. Jesienna 4","WOJ. ZACHODNIOPOMORSKIE",2024-07-31
198/23,"REMBIS KARINA LIS",42-675,"Zbrosławice,  Ziemięcice","ul. Mikulczycka 41 ","WOJ. ŚLĄSKIE",2024-08-09
199/23,"WINE AVENUE Spółka z ograniczoną odpowiedzialnością",00-420,Warszawa,"ul. Szara 10/lok. 217","WOJ. MAZOWIECKIE",2024-08-06
200/23,"S.W. Spółka z ograniczoną odpowiedzialnością",62-002,"Suchy Las","ul. Klonowa 4","WOJ. WIELKOPOLSKIE",2024-07-31
202/23,"ARRIBA  Spółka z ograniczoną odpowiedzialnością",40-833,Katowice,"ul. Obroki 130","WOJ. ŚLĄSKIE",2024-07-31
203/23,"BORYS COMPANY Spółka Akcyjna",80-342,Gdańsk,"ul. Jelitkowska 25/lok. 4","WOJ. POMORSKIE",2024-07-31
204/23,"JARYSZ  Jadwiga Łukasiewicz",72-600,Świnoujście,"ul. Grunwaldzka 47 G","WOJ. ZACHODNIOPOMORSKIE",2024-08-01
205/23,"Świat Konesera Joanna Marchewka",43-300,Bielsko-Biała,"ul. Pięciu Stawów 4","WOJ. ŚLĄSKIE",2024-07-19
206/23,"""ALTI PLUS""  Spółka Akcyjna Spółka Komandytowo-Akcyjna",30-133,Kraków,"ul.  Juliusza Lea 213","WOJ. MAŁOPOLSKIE",2024-08-12
208/23,"IGUANA Górski, Kurek Spółka komandytowa",01-001,Warszawa,"Aleja Jana Pawła II 41A/15","WOJ. MAZOWIECKIE",2024-08-31
209/23,"Alkohole Serwis Spółka z ograniczoną odpowiedzialnością",93-232,Łódź,"ul. Lodowa 108","WOJ. ŁÓDZKIE",2024-07-31
210/23,"UNITED BEVERAGES Spółka Akcyjna",87-100,Toruń,"ul. Przelot 66","WOJ. KUJAWSKO-POMORSKIE",2024-08-22
211/23,"""AS""  S. Kempa P. Lenarczyk Spółka Jawna",78-200,Białogard,"ul. Malinowskiego 5 ","WOJ. ZACHODNIOPOMORSKIE",2024-08-13
212/23,"ORBICO Spółka z ograniczoną odpowiedzialnością",02-823,Warszawa,"ul. Salsy 2","WOJ. MAZOWIECKIE",2024-08-13
213/23,"DELUXE TRADE Spółka z ograniczoną odpowiedzialnością Spółka komandytowa",42-504,Będzin,"ul. Dąbrowska 207","WOJ. ŚLĄSKIE",2024-08-05
216/23,"ATO SPIRITS Spółka  z ograniczoną odpowiedzialnością",90-606,Łódź,"ul. 6 Sierpnia 1/3","WOJ. ŁÓDZKIE",2024-08-10
220/23,"LUX HOLDING GROUP Spółka z ograniczoną odpowiedzialnością",02-699,Warszawa,"ul. Kłobucka 23C/110","WOJ. MAZOWIECKIE",2024-08-31
223/23,"Darwina Property Spółka  zograniczoną odpowiedzialnością",02-796,Warszawa,"ul. Wąwozowa 6/48","WOJ. MAZOWIECKIE",2024-08-31
224/23,"FLOREK Teresa Florczyk",15-617,Białystok,"ul. Nowosielska 40d","WOJ. PODLASKIE",2024-08-31
225/23,"""SIEDLISKO""  Zdzisław Wilk",76-150,Darłowo,"Kopnica 8 ","WOJ. ZACHODNIOPOMORSKIE",2024-09-01
226/23,"WCD Spółka Akcyjna",53-659,Wrocław,"ul. gen. Władysława Sikorskiego 3/2","WOJ. DOLNOŚLĄSKIE",2024-08-28
227/23,"POLMOS ŻYRARDÓW   Spółka z ograniczoną odpowiedzialnością",96-300,Żyrardów,"ul. Mickiewicza 1-3 ","WOJ. MAZOWIECKIE",2024-08-31
228/23,"REVENDO Spółka z ograniczoną odpowiedzialnością",03-185,Warszawa,"ul. Myśliborska 21","WOJ. MAZOWIECKIE",2024-08-24
232/23,"Koneser Polska Spółka z ograniczoną odpowiedzialnością",83-200,"Starogard Gdański","Aleja Armii Krajowej 50","WOJ. POMORSKIE",2024-08-31
233/23,"Lumi Spirits Spółka z ograniczoną odpowiedzialnością",80-175,Gdańsk,"ul. Myśliwska 127B/12","WOJ. POMORSKIE",2024-08-31
234/23,"Dystrybucja Trade Spółka z ograniczoną odpowiedzialnością",01-424,Warszawa,"Aleja Prymasa Tysiąclecia 62","WOJ. MAZOWIECKIE",2024-08-31
236/23,"1979 Distillery Prosta Spółka Akcyjna",62-025,Kostrzyn,"ul. Akacjowa 1","WOJ. WIELKOPOLSKIE",2024-08-31
